{
    "version": "0.1",
    "group": "L",
    "description": "Skeleton scenarios generated from traceability.md (grouped, keyed by scenario id).",
    "scenarios": {
        "L01_defined_transitions": {
            "spec_id": "L01",
            "title": "Only defined transitions",
            "layer": "Core",
            "ops": [],
            "expects": [],
            "notes": "Populate ops/observations to validate this clause (Layer=Core)."
        },
        "L02_primary_state_visibility": {
            "spec_id": "L02",
            "title": "Primary State Visibility",
            "layer": "Core",
            "requires": [
                "ros.lifecycle"
            ],
            "ops": [],
            "expects": [],
            "notes": "Primary state visibility requires lifecycle support. backend_ros does not support this, so SKIP."
        },
        "L03_intermediate_states_hidden": {
            "spec_id": "L03",
            "title": "Intermediate states hidden",
            "layer": "Core",
            "ops": [],
            "expects": [],
            "notes": "Populate ops/observations to validate this clause (Layer=Core)."
        },
        "L04_single_active_transition": {
            "spec_id": "L04",
            "title": "Single active transition",
            "layer": "Core",
            "ops": [],
            "expects": [],
            "notes": "Populate ops/observations to validate this clause (Layer=Core)."
        },
        "L05_concurrent_transition_rejected": {
            "spec_id": "L05",
            "title": "Concurrent transition rejected",
            "layer": "Core",
            "ops": [],
            "expects": [],
            "notes": "Populate ops/observations to validate this clause (Layer=Core)."
        },
        "L06_error_processing_deterministic": {
            "spec_id": "L06",
            "title": "ErrorProcessing deterministic",
            "layer": "Core",
            "ops": [],
            "expects": [],
            "notes": "Populate ops/observations to validate this clause (Layer=Core)."
        },
        "L07_get_state_primary": {
            "spec_id": "L07",
            "title": "GetState reports primary only",
            "layer": "Core",
            "ops": [],
            "expects": [],
            "notes": "Populate ops/observations to validate this clause (Layer=Core)."
        },
        "L08_rejection_observable": {
            "spec_id": "L08",
            "title": "Rejection observable",
            "layer": "Core",
            "ops": [],
            "expects": [],
            "notes": "Populate ops/observations to validate this clause (Layer=Core)."
        },
        "L09_transition_event_emitted": {
            "spec_id": "L09",
            "title": "TransitionEvent emitted",
            "layer": "Core",
            "ops": [],
            "expects": [],
            "notes": "Populate ops/observations to validate this clause (Layer=Core)."
        },
        "L10_shutdown_deterministic": {
            "spec_id": "L10",
            "title": "Shutdown deterministic",
            "layer": "Core",
            "ops": [],
            "expects": [],
            "notes": "Populate ops/observations to validate this clause (Layer=Core)."
        },
        "L11_shutdown_via_deactivate": {
            "spec_id": "L11",
            "title": "Shutdown via Deactivate",
            "layer": "Global",
            "ops": [],
            "expects": [],
            "notes": "Populate ops/observations to validate this clause (Layer=Global)."
        },
        "L12_services_not_gated": {
            "spec_id": "L12",
            "title": "Services Not Gated",
            "layer": "Global",
            "ops": [],
            "expects": [],
            "notes": "Populate ops/observations to validate this clause (Layer=Global)."
        },
        "L13_lifecycle_interface_conformity": {
            "spec_id": "L13",
            "title": "Lifecycle Interface Conformity",
            "layer": "Global",
            "requires": [
                "graph.observe"
            ],
            "ops": [],
            "expects": [],
            "notes": "Interface introspection scenario. Validate lifecycle services exist."
        }
    }
}